,url,id,date,coroner,area,receiver,investigation,circumstances,concerns,spans_matches_query
3364,https://www.judiciary.uk/prevention-of-future-death-reports/kesia-leatherbarrow/,2015-0143,2015-04-16,J. Kearsley,Manchester South,Chief Constable Sir Peter Fahy; Steven Pleasant Chief Executive Tameside Council; Mr Tony Lloyd Police and Crime Commissioner Greater Manchester; Jo Turton Chief Executive Lancashire County Council; Michael Court Chief Executive Pennine Care NHS Foundation Trust; Chief Officer MEDACS Healthcare; Peter Lewis Chief Executive Crown Prosecution Service; National Police Chiefs' Council; Rt Hon Eric Pickles MP Secretary of State for Communities and Local Government; Rt Hon Theresa May MP Home Secretary; Rt Hon Jeremy Hunt MP Secretary of State for Health,On the 5th December 2013 I commenced an investigation into the death of Kesia Lena Mary Leatherbarrow aged 17 years. The investigation concluded at the end of the inquest on the 6th February 2015.,"The deceased had always resided with her family in the Lancashire area. There had been increasing concern about her behaviour including her drug use, her abusive and aggressive outbursts, self-harming and her mental health. She had spent a month in July two thousand and thirteen in the Platform facility in Preston, Lancashire. This is a mental health facility for young people. Upon her discharge matters deteriorated and on the twenty-fifth of October Kesia was arrested by Lancashire Police. Her behaviour whilst in custody was concerning but she was not deemed to require sectioning under the Mental Health Act. Following her release from custody on the twenty-sixth of October she threatened to jump from a bridge. The same day she went to live with her father in the Tameside area of Manchester. Kesia had had little contact with her father and he was not aware of all the recent issues and concerns surrounding Kesia. From this point onwards Kesia had little contact with her mother and step-father who understandably had been severely impacted by the difficulties they had faced with Kesia. Due to concerns about her behaviour whilst she was in police custody in Lancashire, Lancashire Constabulary raised a safeguarding report to the Multi-Agency Safeguarding Hub which led to a referral to Lancashire Children's Services. This referral indicated that Kesia was a high risk and likely to self-harm. Given that Kesia was now residing in the Tameside area the referral was then forwarded by Lancashire Children's Services to Tameside Children's Services. Upon receiving the referral only part of the information provided by Lancashire was then cut and pasted onto Tameside's own referral form which was inputted onto the computer system. There was therefore incomplete information on their own form although the Lancashire form was also scanned onto the Tameside computer system. When the case was reviewed not all of the information was considered as only the incomplete Tameside form was ever read. A decision was taken not to open a file and conduct a social work assessment for Kesia but to send a referral to the Child Adolescent and Mental Health Service. Upon receipt of this referral Pennine NHS Foundation Trust assessed the information provided by Tameside and sent the referral to the administrator of the service for an appointment to be sent to Kesia. No appointment had been sent to Kesia at the time of her death. As a result of her arrest in Lancashire, Kesia was before the Magistrates Court in Preston on the fifth of November two thousand and thirteen. She received a referral order. Lancashire Youth Offending Team attended court and noted Kesia's new address in Tameside. However the case, which was then considered by at least four people in the Lancashire Youth Offending Team, was not transferred over to the Tameside Youth Offending Team at all prior to Kesia's death. On four occasions there was a failure to notice the new address for Kesia which was clearly marked on the documentation on the file. This meant that the referral order assessment and panel process was not commenced and concluded within the national guidelines prior to her death. There was also inappropriate thought given to breaching Kesia for non-compliance of her referral order. From the twenty-sixth of October two thousand and thirteen whilst in the Manchester area Kesia, on at least eight occasions prior to her arrest on the thirtieth of November, had some interaction with officers from Greater Manchester Police. On one occasion she was reported as missing from home by her father; she was located the following day residing with her boyfriend at the Armadale Road address. On two occasions Kesia made calls to the police with allegations of domestic violence against her by her boyfriend. On another occasion she made a report of an assault against her by the ex-partner of her boyfriend. On the twenty-fifth of November Kesia attended at her mother's home in Lancashire where she was aggressive, threatened to push her grandmother down the stairs and had hold of a knife whilst threatening to self-harm. Officers from Lancashire Constabulary attended, Kesia was calm at the time of their arrival and she was taken back to her father's house by her grandmother. Her father was not provided with information as to the exact nature of what had occurred. Lancashire Constabulary made a further referral to their Multi-Agency Safeguarding Hub which assessed Kesia as a medium risk. Following her move to the Manchester area the inquest heard evidence which indicated that from shortly after the twenty-sixth of October Kesia was not in fact residing at her father's. She was in reality spending a lot of time residing with her boyfriend and also staying in other accommodation. On the thirtieth of November Kesia was arrested in Manchester by Greater Manchester Police for criminal damage and possession of cannabis. Shortly after her arrest and before her arrival at the police station, Kesia's presentation changed and she was extremely abusive and aggressive. She remained in police custody, for reasons set out below, until the Monday morning when she was placed before the court. Her behaviour whilst in custody was of concern to custody staff and on two occasions police requested the attendance of medical professionals from MEDACS. Whilst in custody, at the time of the first medical assessment, Kesia made a threat to jump off a bridge if she was released from custody. This was documented on the risk assessment form on the custody record. A full risk assessment was not completed on her arrival into custody nor at any stage during her time in the police station. Following her initial assessment by MEDACS there was a reasonable assessment made that Kesia was intoxicated and a decision taken to allow her time to sleep and potentially sober up. The inquest heard evidence that the first nurse was not able to complete her assessment of Kesia at this stage. A second assessment by MEDACS was conducted sometime later. The inquest heard evidence about this assessment and also viewed the CCTV footage. The inquest found that this assessment was incomplete and fell well short of being a meaningful assessment. In addition the inquest heard evidence as to whether MEDACS should be able to access records held about an individual if they had been assessed by their staff in a different police force area. When assessed in Manchester by MEDACS access to her Lancashire MEDACS records would not have been possible as her name had been entered as unknown and not updated. During her interview and subsequent time in custody Kesia's behaviour remained concerning. A decision was taken not to bail Kesia but to keep her in custody in part due to the concerns officers had about her safety. The inquest heard evidence as to the legislation surrounding seventeen year olds in custody and additionally the availability of PACE beds for children in custody. Whilst in custody Kesia had access to an appropriate adult. The request for an appropriate adult was made by Greater Manchester Police to Tameside Social Services. A form was then sent to the volunteer who attended the police station. In Manchester the volunteer appropriate adult scheme is run by the Police and Crime Commissioner. The form completed by the appropriate adult should then be faxed back to Social Services. This did not happen. Information about the threat Kesia had made to jump off a bridge was passed to the Crown Prosecution Service by way of the MG7 but it was not noted on the Prisoner Escort Record. At court Kesia was seen by her solicitor, Tameside Youth Offending Team and GEO Amey staff before her appearance in court. At no stage did they become aware of the threat Kesia had made whilst in police custody as this was known only to the Crown Prosecution Service. No remand application was made therefore the Crown Prosecution Service did not place the information as to her threat before the court. Whilst being held at the Magistrates Court Kesia's behaviour caused concern. Bail checks on appropriate addresses were not carried out. Kesia was released with a bail condition of residence at her father's address. She left court and went to her boyfriend's address where she stayed the night. She was found later the next morning in the garden of the property having tied a ligature around her neck.","Legislation and the provision of local authority accommodation

The inquest heard evidence that recent changes to legislation means that whilst in custody 17 year olds are now treated as children for the purposes of the Police and Criminal Evidence Act (PACE). However the failure to make legislative changes to the supporting legislation means that for 17 year olds there is an anomaly in the system particularly around the provision of accommodation for a 17 year old who is refused bail. For these purposes a 17 year old is still classed as an adult and not a child and therefore there is no requirement for local authorities to provide accommodation. This would require primary legislation.

There remains no legal requirement for local authorities to provide accommodation for 17 year olds who will then have to remain in police custody if bail is refused. The result is that 17 year old children risk being kept in custody for longer than necessary if there is nowhere suitable for them to be bailed to.

In addition the inquest also heard evidence as to the reality of the situation in practice and the availability of such accommodation for those children to whom the law currently does apply i.e. 16 years and younger. The inquest heard that across Greater Manchester it is estimated that, until recently, in only 10 per cent of cases where the police requested such a service from a local authority a bed was available. Attempts are being made to address this issue but at present the figure remains at approximately 20 per cent and the inquest heard evidence that this was, ""not good enough"".

Again the facts heard at this inquest seem to suggest that children younger than 17 are at risk of being held in custody longer than necessary due to a lack of appropriate facilities. The court heard evidence that the police are in the undesirable position of having to decide whether to detain someone potentially unlawfully or release them when they feel it may be unsafe to do so.

It was clear throughout the inquest that the legislation relating to 17 year olds presented challenges to those professionals who had contact with Kesia. For the purposes of safeguarding and the Children's Act she remained a child, being someone under the age of 18. Equally, however, she was old enough to consent to be in a sexual relationship. The court was left with little doubt that the differing legislative provisions for 17 year olds pose unique challenges for professionals in dealing with people of this age.

Exit risk assessments

The court heard that since Kesias death Greater Manchester Police have implemented a system to try and ensure that this situation does not happen again. It was therefore decided to hold a joint medical and police exit risk assessment when someone who has displayed self-harm ideation or behaviour leaves custody.

Initially this was introduced for people aged 17 and under but as of January 2015 it was extended to all people leaving custody.

Whilst this has been a significant commitment from Greater Manchester Police and has required the funding for an additional doctor the court heard evidence that so far this risk assessment has been conducted on over 144 people leaving custody.

This is clearly capturing a large number of people who are displaying signs of similar behaviour or thoughts as Kesia did whilst in custody and the court heard that a joint medical and police risk assessment on their exit from custody is essential in trying to ensure appropriate support when they leave the police station.

Lancashire Youth Offending Team and Tameside Youth Offending Team

The court heard evidence as to the poor understanding and communication between the Youth Offending teams of Lancashire and Tameside following Kesias re-location to the Manchester area. There was a failure by Lancashire to note her move which led to a delay in her case being transferred, but in addition there was a failure in the communications with Tameside for each team to understand what was being requested and to have oversight of the situation. This led to a lack of involvement with Kesia and a proposal to breach her. It also meant that no effective work was being carried out with her and a missed opportunity to recognise her developing situation in terms of her lack of residence and drug use.

Greater Manchester Police

Safeguarding responsibilities

The inquest heard a great deal of evidence from officers as to their understanding and actions. No intelligence was placed on Kesias nominal profile despite a number of concerning contacts with her by officers. It is a core function of the police to submit such intelligence.

Greater Manchester Police has no stand-alone safeguarding policy for matters which are not criminal. There is no clear guidance to officers regarding what to do to raise safeguarding issues. There is no process for the recording of safeguarding concerns. There is confusion and a lack of understanding as to which agencies officers should refer to and where this should be recorded. The fact that there was no record of Greater Manchester Police's involvement with Kesia, despite her having been reported missing from home, information about drugs, self-harm and being in a relationship with a much older individual did not flag-up one safeguarding referral to another agency was concerning.

Force wide incident notices (FWINS)

There were a number of reported incidents relating to Kesia and her involvement with Greater Manchester police which necessitated the opening of a FWIN. The court heard evidence as to the failure to pass on complete information to the officers who then subsequently attended on Kesia including on one occasion the fact that it had been communicated that she had a knife. The court heard evidence that the failure to pass on important information could impact on the safety of the officers and others and also lead to missed opportunities for safeguarding.

Closing codes for domestic violence incidents

Evidence was heard that when a FWIN is closed a code is attached to it. For domestic violence incidents the closing code relates to people over the age of 16 as being adults. This means that the case is not then automatically passed through to the Child Protection Team within Greater Manchester Police for a review even if one of the people involved is still a child i.e. is 17 years of age.

Whilst the case would still be considered by the Public Protection Investigation Unit however the availability for the child protection unit to have all the information relating to children may be beneficial.

Checks carried out by Public Protection Investigation Unit

Evidence was given to the court that when a Domestic Abuse, Stalking and Harassment form (DASH) is submitted to the PPI unit, where the risk level is standard then no checks on the Police National Computer or the Police National Database are carried out. The rationale for this was not clear although DC Evans indicated this may be due to the volume of work. Clearly the PNC can hold vital information about a potential offender.

Custody handovers

The court heard evidence that the handovers which ensure that custody officers taking charge for detainees and their welfare have to conduct such handovers in their own time. The system at present relies on officers and staff attending work early and sometimes staying late after a 12 hour shift to provide a handover. Whilst it is clear there would need to be some overlap in the times people are on duty, the court heard evidence as to the quality of the handovers which is clearly impacted by the fact that this crucial part of the information sharing process relies entirely on the free-time of officers and staff.

The court was advised that the provision of custody within GMP is currently under review but at present the position remains as it was in 2013.

Completion of the Prisoner Escort Record

The Prisoner Escort Record form was completed over 12 hours prior to Kesia leaving police custody. It was not checked or amended prior to her release and it failed to contain crucial information indicating that whilst in custody Kesia had made a threat to jump from a bridge. This should have been included.

Greater Manchester Police and Pennine Care NHS Foundation Trust

Tameside Diversion Project

The court heard evidence regarding a project in Tameside similar to one in Newcastle the aim of which was apparently to divert young people from the Criminal Justice System. However the court heard that the Tameside Youth Diversion Project is not working as intended. The plan being that once someone is arrested there should be consideration to diverting the young person away from the Criminal Justice System if there is evidence of emotional disturbance or self-harm etc. The court heard evidence that in Tameside this signposting is only taking place to the mental health services once the young person has been processed through the Criminal Justice System and is not in fact acting as a diversion pathway. There was no evidence from those working in custody that any consideration was given to this scheme for Kesia and there appeared to be little knowledge of the scheme. On the face of the evidence the current system appeared to duplicate the work carried out by the 16-19 Mental Health Service.

Greater Manchester Police / Police and Crime Commissioner and local authorities

Multi-agency Safeguarding Hubs

The court heard evidence as to the effective working in County Council and Lancashire Constabulary of the Multi-Agency Safeguarding Hub (MASH). It was clear from the evidence that the interactions Lancashire Constabulary officers had with Kesia led to a simple, effective means of passing on safeguarding information to the MASH. This was not the system in Manchester and the court heard evidence that the development of MASHs across Manchester is still ongoing. The court heard that in Manchester different hubs work differently with different agendas - some relate to domestic violence only and not all of them deal with safeguarding of children. The court was advised that the plan is that by the end of the year across Manchester there will be fully operational safeguarding hubs but that each different local authority wants to go about it in a different way. This will mean that there is a lack of consistency in approach across the different local authorities in Manchester as to what will be dealt with. Worryingly some will not deal with the safeguarding of children and such an approach may lead to a lack of consensus and understanding of their roles. In addition such an individual approach will need careful understanding by other agencies as to what can be referred and what cannot potentially exacerbating an already difficult and confusing situation.

All agencies

Having heard the evidence the court felt that there was a degree of confusion and misunderstanding between all the agencies as to their roles, what they are able and not able to do and also where to access important and effective information. By way of brief examples, when Kesia was in custody MEDACS contacted the Crisis Team to see if Kesia was known to them, Kesia had never been involved with the Crisis Team. There was no contact made with the Mental Health Services who did have information that she was waiting for an appointment or with the Youth Offending Team. Tameside Youth Offending Team did not have access to Tameside Children's Social Care records so did not realise that Kesia had been referred to them.","""Kesia Lena Mary Leatherbarrow aged 17 years""; ""she threatened to jump from a bridge""; ""she was found later the next morning in the garden of the property having tied a ligature around her neck"""
