,url,id,date,coroner,area,receiver,investigation,circumstances,concerns,spans_matches_query
72,https://www.judiciary.uk/prevention-of-future-death-reports/jade-hutchings-prevention-of-future-deaths-report/,2022-0398,2022-10-28,P. Schofield,West Sussex,The Chief Constable Sussex Police; Police and Crime Commissioner,On 24 May 2020 I commenced an investigation into the death of Jade Hutchings aged 18. The investigation concluded at the end of the inquest on 28 September 2022.,"In 2019 Jade's behaviour started to deteriorate. He dropped out of St Pauls' College and started to get involved in criminal activity. He came to the attention of Children Services, the Mental Health Service and the Police having been the victim of assaults, being involved in domestic disputes and having been arrested for aggravated burglary. Alcohol and substance misuse played a substantive part in his lifestyle. At 22:07 on 20th May 2020 Mrs Hutchings Jade's mother reported to the police that Jade who was 18 at the time had not returned home. She said that he had left the house at 17:00 under the influence of alcohol and drugs saying that he would be back soon. He didn't return so Mrs Hutchings contacted his friends but they had not heard from him. She was concerned for her son as this was out of character for him and he had previously been assaulted. The Police treated Jade as a missing person and tried to locate Jade. At 03:00 police located Jade at Hastings Town Centre. He was drunk. The Police did not detain him under Section 136 Mental Health Act as they did think it was necessary. They transported him back home to Haywards Heath. On arriving home he went to bed. When Jade woke up the following morning, he was argumentative with his mother. He eventually calmed down and apologised. Later that morning his mother and sister left the house to go to the shops. They arrived back home at about 14:00 and went upstairs where they found Jade hanging. Mrs Hutchings and some of her neighbours began CPR on Jade and an ambulance arrived along with several police officers who assisted with CPR. Jade was taken to Brighton Hospital where despite treatment he died on 23rd May 2020.",Inadequate police training on mental health during the course of the inquest officers involved in dealing with Jade and in particular around the exercise of their Section 136 powers on twenty first May two thousand and twenty acknowledged that they had received very little mental health training. Some officers could not recall any additional training provided since their initial training when they first joined the force. The officers admitted that although they were aware of the Sussex Police mental health guide they had not read it in full. The expert police witness told the inquest that in his view the online training provision that we were told was being rolled out in Sussex was not sufficient. None of the officers involved in this case had yet undertaken this online training. It was his opinion that officers should be provided with the nationally recognised two day training course written by the College of Policing. The course is available for all police forces to be rolled out locally. This training had not been adopted by Sussex Police. There was also confusion amongst officers and a lack of clear understanding around the provision and use of service the Haven at Millview could provide. Reboot lack of provision for older age group there was clear evidence that Jade was vulnerable and had become involved in violence and crime in two thousand and nineteen the year before his death. It was believed by some that Jade was exploited by gangs running county line drug operations. A need for an early intervention was identified by his social worker and a referral to Reboot was made. The inquest was told that at the time Reboot was prioritising twelve to fourteen years children and as Jade was nearing eighteen they were unable to work with him. This was a missed opportunity for Jade to be involved in a form of early intervention before his life started unravelling and he became more heavily entrenched in the world of crime. It is understood that at the time of Jade's death the Police and Crime Commissioner was responsible for the Reboot scheme but at the time of writing this report the scheme is now run by Sussex Police.,"""Jade Hutchings aged 18""; ""found Jade hanging""; ""he died on 23rd May 2020"""
95,https://www.judiciary.uk/prevention-of-future-death-reports/molly-russell-prevention-of-future-deaths-report/,2022-0315,2022-10-13,A. Walker,Northern District of Greater London,"Secretary of State for Digital, Culture, Media and Sport; Damian Collins MP; Baker & McKenzie LLP; Pinterest; RPC; Meta Platforms; Snap Inc; Twitter International Company c/o Trust & Safety – Legal Policy",On the 21 November 2017 I opened an investigation touching the death of Molly Rose Russell aged 14 years old. I opened an inquest on the 1 December 2017. The inquest concluded on the 30 September 2022. The conclusion of the inquest was “Molly Rose Russell died from an act of self-harm whilst suffering from depression and the negative effects of on-line content”. The medical cause of death was 1a Suspension.,"Molly Rose Russell was found having hanged herself on the twenty-first of November two thousand and seventeen. Molly was 14 years old. Molly appeared a normal healthy girl who was flourishing at school, having settled well into secondary school life and displayed an enthusiastic interest in the performing arts. However, Molly had become depressed, a common condition affecting children of this age. This then worsened into a depressive illness. Molly subscribed to a number of online sites. At the time that these sites were viewed by Molly some of these sites were not safe as they allowed access to adult content that should not have been available for a 14-year-old child to see. The way that the platforms operated meant that Molly had access to images, video clips and text concerning or concerned with self-harm, suicide or that were otherwise negative or depressing in nature. The platform operated in such a way using algorithms as to result, in some circumstances, of binge periods of images, video clips and text some of which were selected and provided without Molly requesting them. These binge periods, if involving this content are likely to have had a negative effect on Molly. Some of this content romanticised acts of self-harm by young people on themselves. Other content sought to isolate and discourage discussion with those who may have been able to help. Molly turned to celebrities for help not realising there was little prospect of a reply. In some cases, the content was particularly graphic, tending to portray self-harm and suicide as an inevitable consequence of a condition that could not be recovered from. The sites normalised her condition focusing on a limited and irrational view without any counterbalance of normality. It is likely that the above material viewed by Molly, already suffering with a depressive illness and vulnerable due to her age, affected her mental health in a negative way and contributed to her death in a more than minimal way.","There was no separation between adult and child parts of the platforms or separate platforms for children and adults. There was no age verification when signing up to the online platform. That the content was not controlled so as to be age specific. That algorithms were used to provide content together with adverts. That the parent, guardian or carer did not have access to the material being viewed or any control over that material. That the child's account was not capable of being separately linked to the parent, guardian or carer's account for monitoring.","""Molly Rose Russell aged 14 years old""; ""Molly Rose Russell died from an act of self-harm""; ""Molly Rose Russell was found having hanged herself"""
149,https://www.judiciary.uk/prevention-of-future-death-reports/chelsea-mooney-prevention-of-future-deaths-report/,2022-0259,2022-08-18,A. Combes,South Yorkshire West District,Cygnet Health Care; NHS England,On 19 April 2021 I commenced an investigation into the death of Chelsea Blue Louise Mooney born on 11 September 2003. The investigation concluded at the end of the inquest which commenced on 7 March 2022. The conclusion of the inquest was On the 10 April 2021 in Cygnet Hospital Sheffield Chelsea Blue Louise Mooney performed an act of self-harm by tying two non-fixed ligatures As a result of insufficient care crucially inadequate observations and the delays in emergency response this led to her unexpected death two days later on 12 April in the Northern General Hospital Sheffield There was also a jury questionnaire which was completed and is appended to this Regulation 28 report for information,It is clear from the evidence that was heard during the inquest that Chelsea initially developed a type of eating disorder that required support. She was admitted to a number of mental health inpatient units leading to her admission to Cygnet in Sheffield. Whilst in this facility a number of material things happened Chelsea began to self-harm using ligatures which was a new behaviour Chelsea's working diagnosis became PTSD Chelsea made a number of allegations of abuse by members of her family and others which required investigating Chelsea declined to share information with her family Chelsea's family were advised that young people are not given a fixed diagnosis and that the working diagnosis was PTSD. Chelsea's family were keen to explore a diagnosis of autism however despite there not being a fixed diagnosis for Chelsea this was not explored by the treating team and Chelsea's diagnosis of PTSD does not appear to have been routinely reviewed through her admission. To be clear I mean that her diagnosis was not reviewed not that her treatment and plans were not reviewed. There also seems to have been a move away from a diagnosis of an eating disorder and following the inquest I am not clear that I understand the rationale for this other than PTSD appeared to be a better fit for Chelsea's symptoms. Chelsea started to use ligatures in Cygnet having not done so previously. Again this does not appear to have been a cause of significant concern and appears to be the norm within Chelsea's peer cohort. There was one particular issue for Chelsea however which came to light during the inquest which was that male members of staff felt concerned about interacting with Chelsea alone even where that delayed support in risky situations. I heard evidence that there came a time when Chelsea did not wish for her parents to be aware of what was happening in Cygnet or have any information about her health and that she had capacity to make this decision. I have subsequently received the Capacity Assessment that supports this view. I also heard in evidence that the Capacity Assessment ought to have been revisited and that there were circumstances when a patient's wishes could not be respected. This was particularly relevant to Chelsea's mother having limited information and then supporting her on s17 leave. I also heard that Chelsea was supported by a legal advisor for the purposes of her detention under the Mental Health Act. I also heard no evidence that her age was considered and whether or not she was competent to make this decision even if she had capacity. Chelsea was 17 at the time of her death this required careful exploration with her and there was no evidence of this. I heard evidence that the check on Chelsea was delayed due to another emergency on the unit namely the tying of a ligature by another individual. I also heard evidence that the timing of Chelsea's checks were not in accordance with recognised policy and ought perhaps to have prompted a different review and approval process although the timings were appropriate and designed to keep Chelsea safe. I heard evidence and the jury expressly accepted that the alarm being pulled for the other patient using a ligature would be heard by Chelsea and was a relevant factor in her ligature event. I then heard that when she was checked the member of staff who checked on her would not lay hands on her as he was a male member of staff alone in the room and was worried about repercussions. He therefore sought support from a female member of staff who went to check on Chelsea and realised that she was not conscious. She then shouted for help and a ligature knife. There were then further delays as others came to observe Chelsea collected the ligature knife and removed the ligature then commenced CPR with the red bag. The jury found that these delays were unreasonable in the circumstances. One of the most compelling pieces of evidence about the co-ordination of CPR was that every member of staff present believed one individual was leading the CPR response however that particular individual was not aware of that. Whilst this did not materially change the CPR in this case it was certainly not indicative of a well-rehearsed and practised response to an emergency situation.,"1 The diagnosis whilst described as not being fixed was not adequately reviewed. The primary witness for Cygnet in relation to diagnosis lacked professional curiosity even when asked questions in evidence. For example dismissing the potential that Chelsea may be hyperbolic in some of her descriptions of incidents and could that be relevant to diagnosis or treatment; evidence from the family about another member of the family with an autism diagnosis was not followed up the evidence from Cygnet being that they had not been aware the family wished to explore this; nonetheless in evidence it was dismissed as a possibility. 2 Whilst it is important that the young person is believed and has confidence in those with a therapeutic relationship that she will be believed when she makes disclosures; there was almost no professional curiosity about the allegations and whether they spoke to something else going on with Chelsea. The allegations that were made were blindly accepted by the team and one example where this was problematic is that part of Chelsea's PTSD diagnosis was based on flashbacks. One of the flashbacks which she described related to finding her aunt dead. Her aunt was not dead and in fact attended the inquest proceedings however this had not been clarified with the family and the treating team accepted this information from Chelsea unequivocally. It is clear there is a very fine balance to tread as it is clear that Chelsea was suffering from flashbacks and had suffered trauma, there was no demonstrable exploration of this. 3 The decision not to share information with family was made based on one capacity assessment. This did not fully address the issues with Chelsea of understanding the consequences of that decision and neither does it adequately break down the information which Cygnet may wish to share with family. This appears to have been a blanket decision and once a capacity assessment determined that Chelsea had the capacity to make that decision there is not evidence available to me of conversations with Chelsea to establish exactly what she would and would not share with family and that the consequences of those decisions were adequately explored with her. I would have expected at Chelsea's age that a social worker would be involved in supporting her with this decision and reviewing it regularly. This decision about her capacity and information sharing were also not revisited which they ought to have been regularly. Not least because Chelsea's mother was responsible for supporting her with s17 leave and was entitled to fully understand the risks to Chelsea or herself through this. 4 There was no evidence of debrief after prior incidents of ligatures or other self-harm attempts and therefore crucial information about Chelsea's state of mind, motivation and methods was missing from future planning and risk assessments. 5 There was limited concern about the number of ligature incidents collectively across the ward. They appear to have been accepted as normal behaviour. There was no record of Chelsea using ligatures prior to her admission onto this ward. This reality for staff appears to have led to a downgrading of the seriousness of the use of ligatures. With staff describing in evidence when they would and would not intervene and what would and would not constitute a serious incident in relation to ligatures ie a hospital admission would be required before it was regarded as a serious incident requiring immediate changes to risk levels and observations. It may be that this approach to ligatures also contributed to the delay in Chelsea's final ligature being removed. 6 Male staff were nervous and uncertain of how to approach Chelsea when they were alone. Clear guidance needed to be made available to them on how to deal with this. Although in evidence staff said that if there was an emergency they would attend even if alone this was not the case in practice as the male member of staff sought female support before recognising that Chelsea was in crisis. 7 The approach of three members of staff checking Chelsea before the ligature knife was brought and used led to avoidable delay. I am aware from the evidence that there are practice exercises involving the Red Bag however I am not clear that the same is practised in relation to the check, identification of a ligature and obtaining and using the ligature knife in these situations. 8 Whilst in evidence I have heard about the practice exercises using the Red Bag it is clear that there was limited confidence and clarity around the CPR needed for Chelsea. There was not a clear structure of one person leading and others knowing exactly what and how to do tasks. 9 There were opportunities for commissioners to support Cygnet earlier when case managing Chelsea's package of care. The new behaviour of using ligatures should have invited professional curiosity from commissioners who should have sought assurance about the overall practice of ligature use and intervention from Cygnet but also what that meant specifically for Chelsea and how Cygnet were keeping her safe. This may have led to a review by Cygnet and a better understanding of Chelsea's ligature use. 10 Commissioners also ought to have spoken to Chelsea themselves and assured themselves about the decision not to share information with her family; particularly her mother who had been a huge support for Chelsea prior to Covid-19. The impact of the cessation of face-to-face visits on anyone detained under the mental health act but particularly young people like Chelsea appears to have been underestimated.","""Chelsea was 17 at the time of her death""; ""Chelsea Blue Louise Mooney performed an act of self-harm by tying two non-fixed ligatures""; ""this led to her unexpected death two days later on 12 April"""
155,https://www.judiciary.uk/prevention-of-future-death-reports/lily-girton-prevention-of-future-deaths-report/,2022-0262,2022-08-11,N. Persaud,East London,"Royal College of Paediatrics & Child Health, NHS England; Medical Director, Health Education England; President, Royal College of Psychiatrists","On the thirteenth June two thousand and nineteen I commenced an investigation into the death of Lily May Girton. Lily was seventeen years old when she passed away on the first June two thousand and nineteen. The investigation concluded at the end of the inquest on the ninth August two thousand and twenty-two. The conclusion of the inquest was a narrative conclusion:

Lily Girton took her own life whilst suffering from a mental illness. Her death was contributed to by a failure of the community CAMHS team to expedite an assessment by a psychiatrist to carefully and robustly assess and manage her risk to self and by a failure to titrate up her anti-depressant medication to an effective dose.","Lily Girton suffered from anxiety, depression and emotional dysregulation. She sought assistance from the Child and Adolescent Mental Health Services in December 2018. She was asked to register with a new GP before she could access the service. On 12 March 2019 she was seen for her first assessment with the team. Later the same day, Lily presented in distress at Euston station and required detention under section 136 of the MHA for her own safety. She was taken to University College Hospital where she was admitted to a paediatric ward and where she received care from the psychiatric liaison team. Following this brief admission, Lily was prescribed antidepressants by her GP who expected the community CAMHS team to continue monitoring and prescribing this medication. The community team did not do this and Lily was not seen by a psychiatrist within the community CAMHS team. Lily was seen by a social worker within the CAMHS team, who had been appointed as her care co-ordinator. The care co-ordinator provided cognitive behavioural therapy. She did not take steps to expedite the psychiatric appointment; did not take steps to ensure that Lily's medication was appropriately titrated and did not carefully assess, document and communicate Lily's risk to self. On 29 April 2019, Lily was admitted to University Hospital again, requiring a longer admission and presenting with higher risk. The concerns of the hospital team were communicated to the community CAMHS teams, but Lily's care plan was not materially altered. On 31 May 2019, Lily was involved in an altercation with a group of males in a kebab shop. She was mocked by the males and she reported that one of the males had hit her. In the early hours of 1 June 2019, Lily was discovered at her partner's home address. Her life was pronounced extinct on scene. Police attended and deemed the circumstances as non-suspicious. The altercation in the kebab shop is likely to have contributed to a decline in Lily's mental state on 31 May 2019. The failings in the care provided to her by the community CAMHS team left Lily without the resilience to manage the decline in her mental state.","The inquest heard that CAMHS services nationally have a lack of adequate staffing levels in the form of doctors, in the form of psychiatrists, registered mental health nurses and psychotherapy staff. The inquest heard that consultants often have an average of 130 to 150 active cases on their caseloads. This is substantially higher than the recommended caseloads by the Royal College of Psychiatrists. The lack of staffing and resources contributed to Lily's death and there is a concern that the ongoing shortages of suitably trained staff within CAMHS teams poses a risk of future deaths of young people.","""Lily was seventeen years old when she passed away""; ""Lily Girton took her own life"""
