,url,id,date,coroner,area,receiver,investigation,circumstances,concerns,spans_matches_query
922,https://www.judiciary.uk/prevention-of-future-death-reports/chelsie-violet/,2021-0018,2020-11-12,G. Irvine,East London,Secretary of State for the Home Department; The Commissioner of Police of the Metropolis Metropolitan Police Service,On the 11 March 2020 I opened an investigation touching the death of Chelsie Violet Greatorex aged 18 years old. I opened an inquest on the 27 March 2020. The inquest concluded on the 2 November 2020.,"Chelsie Greatorex was a victim of a sexual assault on 27th June 2019 at that time she was 17 years of age. The allegation was investigated by PC[REDACTED], an ERPT officer, from [REDACTED] [REDACTED] refers. On 4th March 2020, Ms Greatorex tried to contact PC[REDACTED] without success. PC[REDACTED] contacted Ms Greatorex on 9th March 2020 when Ms Greatorex explained that the purpose of her call on 4th March 2020 was that she felt low. The officer signposted Chelsie to Newham Talking Therapies (NTT). On 10th March 2020 Chelsie took a deliberate overdose of her prescribed medications and sustained a cardiac arrest. Despite emergency paramedic and medical treatment she died later that day at 17.35.",a Evidence heard in the inquest suggested that Ms Greatorex felt anxiety regarding her role as a complainant in a sexual assault trial b Despite the fact that Ms Greatorex was a child when the events of the allegation took place the investigation was not conducted by a specialist officer or team c Delays in the investigation were identified despite naming the suspect and their place of study no interview took place for over three months a decision to prosecute was not arrived at until late December 2020 a court hearing was not listed until January 2020 d When Ms Greatorex sought support from the MPS no contact was made for four days even then the extent of the support was an email with the contact details of a borough psychological support service,"""Chelsie Violet Greatorex aged 18 years old""; ""she was 17 years of age""; ""On 10th March 2020 Chelsie took a deliberate overdose of her prescribed medications and sustained a cardiac arrest. Despite emergency paramedic and medical treatment she died later that day at 17.35."""
927,https://www.judiciary.uk/prevention-of-future-death-reports/xuanze-piao/,2020-0230,2020-11-11,L. Leeper,Coventry,Vice-Chancellor of Coventry University,"On 11 December 2018 an investigation was commenced into the death of Xuanze Piao. The investigation concluded at the end of the inquest on 6 November 2020. The determination of the inquest as to the medical cause of death was a massive head injury and multiple trauma owing to impact with a train, and as to conclusion, suicide.","In autumn 2018, Xuanze was a student attending Coventry University enrolled on a degree course in Architecture. He was aged 17, having been born on 10 December 2000 in the Heping district of Shenyang, China. He was living in student accommodation.

At Coventry University he was categorised as a Tier 4 overseas student. Due to his age and nationality he was required to have a guardian within the UK. A condition of his UK student visa was that he attended his university course. Xuanze's attendance on his university course was limited. Because of the amount of the course he missed he was sent a number of emails requesting his attendance at meetings with staff to discuss his absence. He did not respond to these invitations which resulted in an email being sent to him on 29 November 2018, indicating that he was at risk of being removed from the course and that he should attend a meeting to discuss this on 3 December 2018; removal from the course would in turn have affected his permission to remain in the UK on his student visa. There was no face to face meeting with Xuanze in advance of the email being sent to him on 29 November 2018, and neither Xuanze's family nor his guardian were informed that Xuanze was not attending his university course, nor were they informed of the meeting he had been requested to attend to discuss his removal from the course.

On 3 December 2018 shortly before 5 a.m. Xuanze left his student accommodation and went to Coventry Railway station. He walked to the end of platform one and proceeded along the side of the tracks. Approximately 500 metres outside of Coventry Railway station heading south, Xuanze was struck by a passenger train which caused him to sustain catastrophic injuries. He is likely to have died instantly as a result of the collision and his life was formally declared extinct at 07:35 hours. The inquest conclusion is suicide.",The University did not have a face to face meeting with Xuanze a student under the age of 18 prior to sending him the email dated twenty ninth November two thousand and eighteen indicating that he was at risk of being removed from the course and that he should attend a meeting to discuss this on third December two thousand and eighteen In the absence of a face to face meeting with Xuanze the University did not contact either Xuanze's Guardian or Parents prior to sending Xuanze the email dated twenty ninth November two thousand and eighteen indicating that Xuanze was at risk of being removed from the course and that he should attend a meeting to discuss this on third December two thousand and eighteen Evidence was given at the inquest that in the case of an overseas student under eighteen notwithstanding both prolonged absence from academic commitments and a persistent omission to respond to email requests that the absentee student should make contact with the university there was no procedure or policy in place either for a face to face meeting with the student or in the absence of such a face to face meeting for contacting that student's Guardian or Parents prior to the email being sent indicating that the under eighteen student was at risk of being removed from the course and that he should attend a meeting to discuss this,"""He was aged 17""; ""The inquest conclusion is suicide"""
1151,https://www.judiciary.uk/prevention-of-future-death-reports/shneur-kaye/,2020-0013,2020-01-17,E. Morgan,Manchester North,"The Chief Executive Officer, Bury Council",On the 29th August 2018 the Senior Coroner commenced an investigation into the death of Shneur Zalman Kaye. The inquest concluded on 17th January 2020 when I recorded a conclusion of misadventure.,"Shneur died at home on 24 August 2018 by reason of suffocation caused by inhalation of helium. He was 14 years old. For some years, Shneur had experienced behavioural difficulties. He had been diagnosed with ADHD and had been supported by the community paediatric team. His treatment included regular medication. On 17 April 2017, Shneur was conveyed to North Manchester General Hospital following erratic behaviour and a suggestion of an overdose. North West Ambulance Service filed a safeguarding referral with the Multi Agency Safeguarding Hub operated by Bury on 17 April 2017. At that time, Shneur was not attending any local authority maintained school. He was not previously known to social services. On 19 April 2017, the social worker decided there was no need for action and the referral was closed. Prior to closure of the referral, there was no contact made with the family or with Shneur himself. Following this decision, neither the fact of the referral nor the reasons for it was shared with any third party, service or agency.",The decision to close a referral without prior contact with parents where there is no safeguarding or legal reason why such contact should not be made potentially deprives the social worker of the opportunity to contextualise the event or concern which has triggered the referral and of forming an informed view of the welfare of the child to whom the referral relates The evidence received by the court indicates that the closure of the safeguarding referral marks an end to social services involvement Despite this no attempt is made to share the fact of the referral or the reasons for it with any third party service or agency This may have the unintended result of depriving third parties including parents and agencies already participating in the care and welfare of a child from being alerted to the concern and taking appropriate action including accessing other services in response to it The submissions made on behalf of the council indicate these practices are driven by considerations of data protection compliance The practice imperils the precedence to be given to the paramountcy principle and has the potential to undermine the protection of children who are the subject of referral,"""He was 14 years old""; ""Shneur died at home on 24 August 2018 by reason of suffocation caused by inhalation of helium"""
1165,https://www.judiciary.uk/prevention-of-future-death-reports/jacob-bates/,2019-0456,2019-12-31,P. Nieto,Derby & Derbyshire,"The Rt Hon Gavin Williamson CBE MP, Secretary of State for Education, Department for Education",On 17 July 2017 I commenced an investigation into the death of Jacob Andrew Bates dob 5 January 2000 dod 15 July 2017 The investigation concluded by way of an inquest hearing from 2 to 5 December 2019 a copy of the record of inquest is enclosed with the covering letter to this report My findings at inquest were as follows Medical cause of death 1a Ligature around the neck 1b Mental health issues and autism Summary of circumstances Jacob died as a result of placing plastic ties around his neck as ligatures Although he had not given any immediate indication to anyone that he was contemplating taking his own life he was assessed as being at on-going risk of serious self-harm Due to the nature of the act his self-harm history the on-going assessed risk and his leaving of a suicide note I found that he had undertaken a deliberate act with the intention of taking his own life Just prior to his death a six month unregulated placement had recently been ended and prior to that placement he had spent over two and a half years in a succession of secure placements On the evidence I did not find that factors associated with the unregulated placement had directly contributed to Jacobs death My conclusion as to Jacobs death was a short form conclusion of suicide,"Jacob had diagnoses of autism and mental health problems. Following a serious overdose in February two thousand and fourteen he was thereafter placed in a succession of secure placements under the provisions of the Mental Health Act nineteen eighty-three and the Children Act nineteen eighty-nine until he returned to his home area of Chesterfield around Christmas two thousand and sixteen when he was placed, under the provisions of section twenty Children Act nineteen eighty-nine, in an unregulated placement for young people aged between sixteen and eighteen years of age and was also supported by local authority social care and child and adolescent mental health services. The Chesterfield placement was not a specialist placement for young people with autism or mental health problems and the placement had been made in the context of a specialist placement having given very short notice of termination of placement. There had been many episodes of self-harm following the overdose in February, some serious, including just two months prior to his death and he was assessed at ongoing risk of serious self-harm. The Chesterfield placement came to an end following Jacob's decision to move in to live with his father where he received ongoing support from the agencies.","Vulnerable young people aged 16 to 18 are being placed in unregulated placements. Any young person under the age of 18 placed in an unregulated placement is likely to have very significant vulnerabilities, and it is likely that young people with complex needs and at significant risk are being placed in such placements; indeed this was the case for Jacob. As the placements are unregulated there are no statutory regulations to comply with relating to competency and appropriate policies and procedures by the provider and there is no regulatory body to check and assess those providers. This is clearly a very concerning situation given the very high level needs that some of the young people will have. The lack of statutory regulation then places an onus on local authorities to check that a provider is competent and safe. Whilst in making individual placements it must be the duty of a local authority to satisfy itself as best as it is able that placements are safe, given the pressures on local authorities it cannot be the case that they are in a position to mirror the type and nature of inspection and oversight that might be provided by a regulator such as Ofsted. In view of the points made above the lack of statutory regulation is placing vulnerable young people at risk, and there is a realistic possibility that deaths may occur.","""dob 5 January 2000""; ""dod 15 July 2017""; ""My conclusion as to Jacobs death was a short form conclusion of suicide"""
1240,https://www.judiciary.uk/prevention-of-future-death-reports/katie-croft/,2019-0393,2019-11-19,A. Mutch,Greater Manchester South,College of Policing; Secretary of State for Education; Secretary of State for Health and Social Care,On 17 January 2019 I commenced an investigation into the death of Katie Croft. The investigation concluded on 17 October 2019 and the conclusion was one of suicide. The medical cause of death was 1a severe hypoxic-ischemic encephalopathy 1b asphyxia from hanging,"Katie Croft was a vulnerable child who was a victim of abuse which she reported. On seventeenth October two thousand and eighteen Greater Manchester Police and Tameside Children's Services began an investigation. Katie was spoken to by both agencies having already given a detailed account to her school, which had reported the disclosure. The working together principles applied to the investigation which require that the voice of the child should be a focus for all agencies.

Subsequently Katie via her mother indicated she did not want to support a prosecution. The case was closed by Greater Manchester Police without being countersigned by a supervisor or any further face to face discussion with Katie or assessment of the evidence. A multi-agency strategy meeting was held and concluded Katie was being safeguarded. A child and family assessment was subsequently completed by an agency social worker from Children's Services without any further discussion with Katie. It was not shared with Katie or her family.

On eighteenth December two thousand and eighteen Katie disclosed to her form teacher that she was considering self-harm or worse. A cause for concern form was completed but subsequently misplaced. Action was taken to notify her parents of Katie's disclosure and her mother was spoken to. Katie had previously self-harmed. No further action was taken in relation to this disclosure. On eighth January two thousand and nineteen Katie sent her previous form teacher, who had left the school, a message via social media. She said she had no one else to talk to who knew what she was feeling and that she thought about the abuse every day and had cut herself the day before. The message was shared with the school safeguarding lead that evening and Katie was spoken to at school the following day. She denied sending the message.

She continued with lessons. School attempted to notify her family of the concern. After school she returned home. As a result of concerns raised by one of her friends school were contacted and contact was made with her family who tried to contact her and check on her wellbeing. Her friend went to check on her and found Katie suspended from a ligature at her home address.

She was resuscitated and taken to hospital. However she had sustained catastrophic brain damage and died at Royal Manchester Children's Hospital on fifteenth January two thousand and nineteen.","The inquest was told that GMP followed their own guidance which accorded with that of the College of Policing into the level of expertise of the officer allocated to investigate Katie's allegations. As a result of this the case was not dealt with by an experienced Public Protection or specialist sexual offences trained officer. It was allocated to a probationary police constable with approximately six months experience. The officer did not seize the phone which contained key social media contents until her third visit on the initial evening the offence was disclosed. The allocated officer was not experienced in joint working with social services or familiar with the concept of the voice of the child and what it would mean in such a case. At the time the decision was made by police to NFA matters there was no discussion about whether there could be a victimless prosecution; it was not established if the initial account was recorded on body worn footage or the extent of the social media contact by the suspect and the nature of any offences that could be revealed by those messages. No attempt was made to have a further face to face conversation with Katie

The Local Authority at the time were using a substantial number of agency social workers. As a result the Child and Family Assessment was not completed in accordance with best practice and not shared in accordance with expectations around best practice. The Local Authority has since made significant progress in moving away from a reliance on agency staff to fill gaps in social work cover. The inquest was told that agency social workers are still used extensively in other Local Authorities creating a risk that a similar situation could arise

At the safeguarding strategy meeting an officer allocated to attend such meetings on behalf of GMP attended rather than an officer allocated to the case. As a result the quality of information sharing and understanding of the allegation was more limited. On the particular police division in question this practice has stopped. It was unclear how common the approach is on a wider basis

It was accepted by witnesses for both the Local Authority and GMP that the voice of the child was not fully heard throughout their investigations. They via the safeguarding board commissioned an independent report whose findings and recommendations have been fully adopted by the safeguarding board. It was unclear what if any steps would be taken to disseminate the lessons pan GM or nationally

A further concern identified was that there was no mechanism for the school to be formally be aware of information within the Child and Family Assessment. As a result there was no formal follow-up procedure set out in the best practice national guidance the school was working within. The inquest heard that Katie's school recognising this gap has built on the working together guidance to develop guidance that ensures there is a proactive approach to engaging with a child and their family post the writing of a Child and Family Assessment

On the day Katie committed suicide she had attended a GCSE English class. The exam board required poetry syllabus was being studied that day. The lesson included a poem where the contextualisation of it included the use of suicide. The teacher delivering the lesson had no way of understanding the history of self-harm of Katie and her particular vulnerability when delivering a set text in accordance with the exam board requirements. It was unclear what if any guidance is given by the exam board to assist teachers minimising risk to pupils in this scenario","""Katie Croft""; ""conclusion was one of suicide""; ""Katie was a vulnerable child""; ""died at Royal Manchester Children's Hospital on fifteenth January two thousand and nineteen"""
