,url,id,date,coroner,area,receiver,investigation,circumstances,concerns,spans_matches_query
2181,https://www.judiciary.uk/prevention-of-future-death-reports/jeff-antwis/,2017-0392,2017-11-13,J. Ellery,"Shropshire, Telford & Wrekin","Mr Neil Carr OBE, The Chief Executive of South Staffordshire and Shropshire NHS Trust",On 31 January 2017 commenced an investigation into the death of Jeff David Antwis 14 years of age The investigation concluded at the end of the inquest on 9 November 2017 The conclusion of the inquest was suicide,On Monday 30 January 2017 at approximately 05:30 hours a train travelling south along the railway line at Harlescott level crossing Shrewsbury struck the deceased causing serious head injuries. He was transferred by ambulance to the Royal Stoke University Hospital where at 17:18 hours he was confirmed dead. The deceased was a vulnerable teenager with a diagnosis of Asperger's syndrome with a history of self-harm escalating to suicide attempts. In answers to a miracle question he indicated that he wished to die. An urgent medical review was appropriate but not carried out however it cannot be said to have caused or contributed to the death.,Following an urgent referral by Jeff's GP to the then Shropshire CAMHS on the 10th January 2017 a timely response was made with an initial appointment with a mental health practitioner taking place on the 12th. A further appointment was arranged for the 25th January an earlier date clashed with an existing medical appointment and in the meantime Jeff was given a miracle question to complete. Jeff answered the miracle question indicating that he wished to die. He passed it to his mother who immediately contacted the mental health practitioner who in turn referred it and the initial assessment to a consultant physiatrist for review. The consultant physiatrist did not consider the matter urgent and arranged for a routine medical review for the 17th March 2017. At the second meeting on the 25th January 2017 Jeff and his mother were informed of the appointment for the 17th March 2017. Jeff's mother immediately raised concerns and asked for it to be brought forward. She was told she would have to write in and make a complaint. This was a time sensitive situation adding to the problem without resolving it. On the 30th January 2017 Jeff killed himself on the railway line. Independent expert evidence from a child and adolescent consultant physiatrist indicated that Jeff should have been offered an urgent medical review appointment for the 27th January 2017 i.e. within seven days of the internal referral to the consultant physiatrist and not as a routine appointment the 17th March 2017. It cannot be said that such earlier appointment would have addressed Jeff's problems and altered his wish to die but it is it possible that earlier intervention may have lifted his spirits and not according to his mother wilted. It undoubtedly would have helped and at least been an earlier step in seeking to help Jeff. Other matters of concern arose from the evidence. The mental health practitioner was aware of the deliberate self-harm protocol but not its content. Carried out a risk assessment on a subjective basis without reference to any known definition e.g. serious or significant. Had no mechanism for referring back to the consultant physiatrist appointment whether she agreed with the request or not. As stated Jeff had a diagnosis of Asperger's syndrome with autistic spectrum disorder. Concerns were raised to what extent these conditions may have masked Jeff's suicidal ideation on presentation and to what extent if it is the case they were recognised. From evidence given at the inquest it is clear that the provision of child and adolescent mental health service is in transition having moved from Shropshire CAMHS to part of South Staffordshire and Shropshire NHS Trust. Certain actions are already being taken and these concerns are raised so that a holistic approach can be taken and fed in to what is already an ongoing wider review.,"""Jeff David Antwis 14 years of age""; ""The conclusion of the inquest was suicide""; ""On the 30th January 2017 Jeff killed himself on the railway line"""
2224,https://www.judiciary.uk/prevention-of-future-death-reports/sofia-legg/,2017-0293,2017-10-04,T. Williams,Somerset,"Head of Services CAMHS West; The Managing Director, NHS Somerset Clinical Commissioning Group; Director of Children's Services, Somerset County Council","On 22nd September 2016 I commenced an investigation into the death of Sofia Ann Legg. Sofia was aged 14 years when she died on 26th September 2016. The medical cause of death was hanging. The conclusion of the inquest was suicide, that on 20th September 2016 at 25 Saxon Way, Cheddar, Sofia deliberately suspended herself by the neck with the intention of ending her life.","Sofia had previously suffered from low mood. In Year 8 both school and family noticed significant changes in Sofia's behaviour, including self-harming. Sofia's mother was sufficiently concerned to attend the family GP who wrote to CAMHS West supporting a referral from Sofia's school. By letter dated 2 April 2015 CAMHS West stated that Sofia's difficulties did not meet criteria for specialist CAMHS intervention. In February 2016 Sofia attended her GP with her mother, Sofia's hair was starting to break, her self-confidence fell as her hair became thinner. Sofia and her mother returned to the GP a number of times and in June 2016 the GP agreed if Sofia was stressed, it was documented that Sofia has been low for months, was self-harming again but denied any suicidal thoughts. Following an attendance at the GP on 12 July 2016 it was noted that Sofia has expressed some suicidal thoughts. An expert referral was made to CAMHS West. Sofia was seen by a care coordinator at CAMHS West on 15 July 2016 and again on 29 July 2016. Sofia was given the opportunity to speak to the care coordinator alone. Sofia was placed on a six month waiting list for CBT. Sofia appeared to her mother to have a good summer holiday but upon returning to school in September 2016 Sofia started to isolate herself. Sofia's mother arranged an appointment with Sofia's care coordinator at CAMHS on 19 September 2016. Again Sofia had the chance to speak to the care coordinator alone and again Sofia admitted to suicidal thoughts. From the evidence of the care coordinator and Sofia's mother it was identified that there was a difference in recollection of what was discussed and expressed at that meeting. Matters that the care coordinator identified as discussed were not subsequently identified in Sofia's care plan, the care coordinator has no urgent contact with Sofia's school and no urgent contact with a psychiatrist. No follow up appointment was made. On the following day 26 September 2016 Sofia's mother following discussions with Sofia attended work and upon return home discovered Sofia hanging. Sofia left an apologetic suicide note.","Access to CAMHS. Sofia was rejected for referral in April 2015. Might a lower threshold and earlier proactive interventionist policy have been of positive benefits to Sofia. Availability of CBT. Sofia was placed on a six month waiting list for CBT. This delay appears considerable. Sofia's care co-ordinator at CAMHS did not obtain the urgent input of a psychiatrist in accordance with NICE guidance. The recollections of Sofia's care co-ordinator and Sofia's mother as to the meeting of the nineteenth September were at odds with each other. Sofia's care co-ordinator recollected in her evidence telling Sofia's mother that Sofia was not to be left alone. Sofia's mother deemed the impression from Sofia's care co-ordinator's evidence was of Sofia being in an extremely vulnerable and dangerous position but this was not reflected in Sofia's care plan which made no mention of her not being left alone and it was not reflected in the care co-ordinator's actions in not urgently contacting Sofia's school, where she would be during the following days, to a psychiatrist. Her care plan appears to be the critical written record of the outcomes of this meeting as it was not of sufficient detail to safeguard Sofia. Language used in the SIRI report was felt to be inappropriate. The SIRI report effectively said if the care plan had been followed the outcome might have been different and that no change in clinical practice would have resulted in any different outcome. I do not believe either of these statements were true.","""Sofia was aged 14 years when she died""; ""The conclusion of the inquest was suicide""; ""Sofia deliberately suspended herself by the neck with the intention of ending her life"""
2260,https://www.judiciary.uk/prevention-of-future-death-reports/brandon-singh-rayat/,2017-0231,2017-09-06,D. Hocking,Leicester City and Leicestershire South,"The Rt Hon Jeremy Hunt MP, Secretary of State for Health; Chief Operating Officer, East Leicestershire and Rutland CCG","On 10 August 2016 I commenced an investigation into the death of Brandon Singh Rayat, aged 15 years. The investigation concluded at the end of the inquest on 31 August 2017. The conclusion of the inquest was suicide.","In April two thousand and fifteen Brandon refused to go to school and became more and more reclusive and anxious. He was taken to the GP by his mum and he was entered into the care of the Child and Adolescent Mental Health Services. He was diagnosed with low mood and anxiety and was treated with fluoxetine. His mental health continued to deteriorate and he refused to engage with any professionals tasked with trying to assist him. His mother went to his mental health appointments alone without her son and the majority of the contact with either her or Brandon was by telephone. At times she managed to get him into the car but when they arrived at the appointment he absolutely refused to get out of the car in order to see the clinician due to his anxieties. Appointments were made appropriately by health care staff but contact with him by health professionals was via occasional telephone calls, when he agreed to speak to them. The last face to face contact with any member of the health care team was on the thirty first May two thousand and sixteen and his suicide occurred on the ninth August two thousand and sixteen. It was established that the efficacy of his care was compromised because of this lack of contact but Brandon was simply too anxious to attend out patients appointments and there was no provision or funding for the clinicians to go to Brandon's home to treat him.",That there is no provision of mental health care for children in Leicestershire who due to their anxiety are unable to attend hospital for treatment. There is a CRISIS team for children but I have been told that this cannot fulfil the function of long term treatment.,"""Brandon Singh Rayat, aged 15 years""; ""The conclusion of the inquest was suicide"""
2292,https://www.judiciary.uk/prevention-of-future-death-reports/fallon-abby/,2017-0288,2017-08-08,M. Hassell,Inner North London,Dr Kevin Cleary Medical Director East London NHS Foundation Trust,"On 19 February 2002, one of my assistant coroners, Heather Williams, commenced an investigation into the death of Fallon Abby, aged 18 years. The investigation concluded at the end of the inquest on 7 August 2017.",Fallon had attended the emergency unit at the Royal London Hospital a week before her death following an intentional overdose then represented with alcohol toxicity. She was admitted to Roman Ward of Mile End Hospital because she was thought to be at high risk of suicide. She was discharged to the care of the home treatment team on Thursday 16 February 2017.,"I heard at inquest that no member of the team on Roman Ward contacted Fallon’s social worker. There was no protocol for this. If they had sought a collateral history from the social worker, they would have discovered that Fallon’s mum was not dead as Fallon had told them, but was alive and living in a hostel. The social worker had been rung by a nurse at the Royal London Hospital, but she was waiting to be invited to a ward round at Mile End Hospital and such invitation was never made. It seems unlikely that proper discussion with the social worker would have changed the outcome for Fallon, but it would have meant that valuable information would have been shared, and it would have meant that Fallon would have had the benefit of her social worker on hand upon discharge. This might be very important for another patient.","""Fallon Abby, aged 18 years""; ""high risk of suicide"""
2322,https://www.judiciary.uk/prevention-of-future-death-reports/steffan-bonnot/,2017-0450,2017-07-14,P. Schofield,West Sussex,Amanda Spielman Chief Executive Ofsted,On 5 July 2017 I concluded the inquest into the death of Steffan Bonnot born 6 November 1988 aged 17 who died on 1 January 2016. His inquest was originally opened on 12 January 2016. The conclusion that I reached at the inquest was that Steffan committed suicide. At the time of his death he was in the care of Brighton and Hove Local Authority.,"Steffan was a young man who had spent a considerable amount of time in foster care and children's homes. He was due to move out of the Amicus Community Children's home and into another foster placement on sixteenth January two thousand and sixteen. It was clear from the evidence that he was concerned about leaving the Amicus Community and that he was anxious about whether or not the foster carers were fully appraised of his background. He had had a large number of foster placements in the past many of which had broken down. The concerns he had about how much the foster carers knew caused him some anxiety. On Friday first January two thousand and sixteen Steffan was amongst a small group of children who attended the local cinema. This was a pre-arranged outing. On the return from the cinema Steffan's group, which consisted of two staff and another child, stopped off at MacDonalds. Shortly after arriving at MacDonalds Steffan and the other young man went to the toilet. A member of staff followed them shortly afterwards and asked them to come out. Steffan did so but then left MacDonalds without saying anything. The staff tried to follow him and locate him. They were unable to do so and sadly Steffan's body was later found at the Warningcamp foot crossing having been struck by a train. Steffan had deliberately knelt down in front of an oncoming train.","The author of the serious case review reported that the prospective foster carers who were to offer a placement to Steffan had advised that they had not been made fully aware of all the background to Steffan's case. This was, however, at odds with what Steffan's social worker told us. However there was no formal documentation detailing exactly what had been disclosed. It was not therefore possible to be clear what information the prospective foster carer had been given. As we know the failing to provide foster carers with all the background information was one of Steffan's major concerns and added to his level of anxiety about his move. The above concern would apply equally to any individuals entrusted with the care of a child. All relevant information should be made available and it should be documented as to what has been provided so that the carers can make an informed decision before any placement is agreed. The young person could then be confident as to what the prospective carer's knew.","""aged 17""; ""Steffan committed suicide""; ""Steffan had deliberately knelt down in front of an oncoming train"""
2365,https://www.judiciary.uk/prevention-of-future-death-reports/george-cheese/,2017-0179,2017-06-06,P. Bedford,Berkshire,The Director of Primary Care; Woodley Centre Surgery,I conducted an inquest into the death of Mr George Arthur Cheese that was heard at Reading Town Hall between the 23rd and 25th May 2017 inclusive. The conclusion of the inquest was that Mr Cheese took his own life whilst suffering from a depressive disorder brought on by a series of life events. A full copy of the narrative conclusion is attached.,Mr Cheese was an 18 year old young man who was found hanging in woodland near his home address on 9 April 2015. He had a number of ongoing issues in his life including the potential loss of a career in the army; a fluctuating relationship with his girlfriend; an unsubstantiated concern that he might have a serious illness and he had been subject to upsetting treatment by his colleagues at work. He was under the care of his GP surgery and the local mental health team who were treating him for anxiety and depression including prescribing anti-depressant medication.,"(1) While the evidence at the inquest dealt with the various matters ongoing in Mr Cheese’s life, I also heard evidence of the care and treatment that he received from his GP surgery. One of the doctors at the surgery gave live evidence at the inquest.

(2) Mr Cheese was prescribed fluoxetine anti-depressant medication on the 3rd November 2014 by a treating GP, following admitting to fleeting suicidal thoughts. He was reviewed on 14th January 2015 when Mr Cheese described daily episodes of intense low mood with suicidal thoughts which included taking an overdose. This led to a reference to the mental health team. At an appointment with the practice’s nurse practitioner on 3rd February, Mr Cheese was prescribed 112 tablets of fluoxetine. In the course of her evidence, it was stated that the nurse practitioner was probably just repeating the same prescription that the previous doctor had issued to Mr Cheese but that she would not have done that.

(3) It was also acknowledged, in the course of her evidence, that there was no flag on Mr Cheese’s notes to alert treating clinicians within the GP practise to limit the amount of medication provided to Mr Cheese in view of his history. She acknowledged that a flag, in such circumstances, was good practise.

(4) The concerns arising from the evidence are therefore the amount of medication prescribed to a patient who was known to be suffering from mental health issues and describing suicidal thoughts and a potential overdose and the fact that this was not being flagged to prevent large amounts of medication being provided to him as a matter of repeat prescription.","""Mr Cheese was an 18 year old young man""; ""Mr Cheese took his own life""; ""found hanging"""
2482,https://www.judiciary.uk/prevention-of-future-death-reports/annabel-lewis/,2017-0085,2017-03-09,M. Jones,Staffordshire South,South Staffordshire and Shropshire NHS Trust; Child and Adolescent Mental Health Service,On 8 November 2016 I commenced an investigation into the death of Annabel Mae Lewis aged 15. The investigation concluded at the end of the inquest on 8 March 2017. The conclusion of the inquest was suicide and the cause of death 1a asphyxia 1b external airways obstruction.,The deceased had been anxious and suffering from low self-esteem for some time. She was concerned about her weight. There had been some recent family relationship difficulties and she experienced peer pressure at school relating to a stormy relationship that she had with her boyfriend. She had been referred to child and adult mental health services (CAMHS) in November 2015 by her GP but that referral was not accepted. She was referred again by her school on the 20th October 2016. The following day she had contact with the CAMHS team who offered her an appointment which she declined because of difficulty accessing the venue. On the 4th November 2016 the CAMHS team attempted unsuccessfully to contact the school referrer. On the same day her family perceived that she returned home from school unhappy. At about 1700 hours she went to her bedroom at her home address saying she had a migraine. At 1710 hours she received a text from her boyfriend saying he wished to end their relationship. At 1713 hours they spoke on the phone and she indicated to him that she was going to kill herself. At about 2200 hours her father went to her bedroom and found her on the bedroom floor with a plastic bag over her head tied underneath her chin. She was certified dead at the scene.,At the inquest it was evident that Annabel had been referred by her GP to your team in November 2015 but that referral had not been accepted. She was referred again on 20 October 2016 by her school. This time the referral was accepted and your team made contact with her by telephone on 21 October 2016. She declined an appointment because she felt she could not get to the venue. No level of risk was recorded and next of kin details were not available. The date of appointment offered and declined were not recorded. Alternative time for appointment was not recorded. No follow up arrangements were recorded. There was no attempt to contact Annabel thereafter. An unsuccessful attempt to contact the referrer was made on 4 November 2016 the day Annabel took her own life. The time period between referral and initial contact and attempted follow up appears considerable. No attempt appears to have been made to engage with her parents who would have been in a position to assist with transport arrangements. The expectation that young people such as Annabel would 'opt in' to the system may be unrealistic given the difficulties that she had in engaging. Annabel might well have benefitted had she been offered a more proactive service.,"""Annabel Mae Lewis aged 15""; ""The conclusion of the inquest was suicide""; ""she was certified dead at the scene"""
2584,https://www.judiciary.uk/prevention-of-future-death-reports/rachal-murphy/,2016-0401,2016-12-08,J. Kearsley,Manchester South,Pennine Care NHS Foundation Trust; Tameside Council - Early Help Services,On the twenty-fifth of August two thousand and sixteen I concluded the inquest into the death of Rachal Marie Murphy date of birth twenty-four January two thousand who died on the eighth of September two thousand and fifteen I recorded that the deceased on or around the eighth of September two thousand and fifteen at her home address had taken a quantity of medication which was prescribed to other family members At the time she had a number of medical and social issues which were being investigated The medical cause of death was confirmed as 1a Acute Hypoxia due to 1b Morphine overdose Conclusion deceased had taken her own life,"The inquest into the death of Rachal Murphy heard how a number of agencies were involved with Rachal and her family. Rachal had not been attending school for a long period of time. She was being investigated for epilepsy and it was reported by her family that she was having seizures on a daily basis. These were not confirmed on any of the investigations undertaken.

By 2014 there were concerns by professionals as to both the underlying cause of any medical condition but also her lack of schooling, her lack of interaction and underlying stressors which may have been impacting on any medical condition.

There was also some evidence that she had attempted to self harm but this was denied by her family. The court heard that by March 2015 they were concerned that there was no counsellor involved with Rachal. By this stage it was accepted by Rachal's consultant that there should have been a referral to Child Adolescent Mental Health Services. The court also heard that there was some confusion as to whether a direct referral could be made to the Clinical Psychology Services.

A CAF process had been commenced because of concerns about Rachal but there was a complete lack of progression for this process until the involvement of the Early Help Services. A meeting did take place on the seventeenth June 2015 but having heard the evidence the court found that at best from March 2015 there was a fractured, disjointed plan as to how to proceed with Rachal's care.

By the time of Rachal's death there was a complete lack of action in respect of the plan for Rachal. Those involved with her medical care wanted input from mental health services to whom no referral had been made. Those involved with her social matters had wanted an outcome on her medical conditions.","GP services

There was a failure to undertake annual liver function tests in 2014 and 2015. The CAF documentation was completely overlooked and simply placed in the medical records as read only which led to no GP involvement in the inter-agency framework and handling of this case.

Tameside NHS FT and Pennine Care NHS FT

There was a lack of understanding between medical professionals as to the means by which someone could be referred to psychological services and whether there was an unclear message from psychological services as to whether they were accepting referrals. Lack of understanding amongst medical professionals as to the cases which may or may not be suitable for referral to CAMHS. There was a significant delay in the reporting of Rachals EEG and the Court heard that this remained the case in respect of reporting of EEGs at the time of the inquest.

Tameside MBC - Early Help Services

The Court heard that there was a significant delay in the allocation of cases within Early Help Services and from the evidence the Court was not satisfied that this had been resolved.","""date of birth twenty-four January two thousand""; ""Conclusion deceased had taken her own life"""
